{
  "schema_version": 1,
  "event_id": "evt_0da69ab832b1f5aa1a27d88e",
  "source_id": "2e54c62eb839a837",
  "source_name": "mvk-codeqa",
  "session_id": "ses_00fdbcb3affezdUs1su8KIvq3b",
  "parent_session_id": null,
  "sequence": 9,
  "event_type": "tool.execute.after",
  "event_time": null,
  "observed_at": "2026-08-10T14:00:09.000Z",
  "context": {
    "project": "mvk",
    "directory": "/workspace/mvk-egis",
    "worktree": "/workspace/mvk-egis",
    "hostname": "geo-ai",
    "opencode_version": "1.18.16",
    "plugin_version": "0.1.0",
    "inference_base_url": "http://192.168.100.55:4099"
  },
  "payload": {
    "tool": "bash",
    "callID": "call_001",
    "sessionID": "ses_00fdbcb3affezdUs1su8KIvq3b",
    "args": {
      "command": "sqlcmd -Q \"SELECT TOP 10 * FROM [Клиенты] WHERE Статус = 'активен'\""
    },
    "title": "bash",
    "output": "10 rows returned in 18400ms",
    "metadata": {
      "exitCode": 0
    }
  }
}